{
  "id": "episode-2026-06-27-session-2599-recover-adr-075-form-factor-eval-methodology",
  "session": "2026-06-27-session-2599-recover-adr-075-form-factor-eval-methodology",
  "timestamp": "2026-06-27T00:00:00+00:00",
  "outcome": "success",
  "task": "Recover ADR-075 form-factor eval methodology and first verdict for issue 1875",
  "decisions": [],
  "events": [
    {
      "id": "e001",
      "timestamp": "2026-06-27T00:00:00+00:00",
      "type": "milestone",
      "content": "Recovered ADR-075 form-factor eval methodology from orphan commit 109b15ae3b onto a branch off main; verified the documented harness matches current code (#2426 --include-skill/--skill-path); ran adr-review 6-agent debate (consensus ACCEPT/Disagree-and-Commit, no blocks); applied fixes (fixture count F001-F016, verdict sharpened to name cost as tiebreaker, content-confound and per-fixture-data caveats, ADR-073 frontmatter); carried the real run artifacts 20260619T161735Z-ad60bbe5.",
      "caused_by": [],
      "leads_to": [
        "e002"
      ]
    },
    {
      "id": "e002",
      "timestamp": "2026-06-27T19:58:15+00:00",
      "type": "commit",
      "content": "Commit: ef41d35dbd6315baa9da70359bf8c6f83c1134ea",
      "caused_by": [
        "e001"
      ],
      "leads_to": []
    }
  ],
  "metrics": {
    "duration_minutes": 0,
    "tool_calls": 0,
    "errors": 0,
    "recoveries": 0,
    "commits": 3,
    "files_changed": 5
  },
  "lessons": []
}
