{
  "id": "episode-2026-07-04-session-2606-babysit-2850-milestone-exit-codes",
  "session": "2026-07-04-session-2606-babysit-2850-milestone-exit-codes",
  "timestamp": "2026-07-04T00:00:00+00:00",
  "outcome": "success",
  "task": "Babysit PR 2850 milestone exit codes to merge",
  "decisions": [],
  "events": [
    {
      "id": "e001",
      "timestamp": "2026-07-04T00:00:00+00:00",
      "type": "milestone",
      "content": "Created dedicated worktree for PR #2850 and assessed failing checks.",
      "caused_by": [],
      "leads_to": []
    },
    {
      "id": "e002",
      "timestamp": "2026-07-04T00:00:00+00:00",
      "type": "milestone",
      "content": "Rebased onto origin/main, resolved milestone setter conflicts, and kept timeout behavior from main.",
      "caused_by": [],
      "leads_to": []
    },
    {
      "id": "e003",
      "timestamp": "2026-07-04T00:00:00+00:00",
      "type": "milestone",
      "content": "Fixed milestone exit codes, failed-query behavior, related tests, and dispatcher project-dir test isolation.",
      "caused_by": [],
      "leads_to": []
    },
    {
      "id": "e004",
      "timestamp": "2026-07-04T00:00:00+00:00",
      "type": "milestone",
      "content": "Updated PR body to include Fixes #2847 and template sections.",
      "caused_by": [],
      "leads_to": []
    },
    {
      "id": "e005",
      "timestamp": "2026-07-04T00:00:00+00:00",
      "type": "milestone",
      "content": "Bumped both plugin manifests to 0.5.256 and verified targeted pytest plus scoped ruff.",
      "caused_by": [],
      "leads_to": []
    },
    {
      "id": "e006",
      "timestamp": "2026-07-04T00:00:00+00:00",
      "type": "commit",
      "content": "Commit: f1f33e3f3",
      "caused_by": [],
      "leads_to": []
    },
    {
      "id": "e007",
      "timestamp": "2026-07-04T00:00:00+00:00",
      "type": "milestone",
      "content": "Bumped both plugin manifests to 0.5.258 and verified targeted pytest plus scoped ruff.",
      "caused_by": [],
      "leads_to": []
    }
  ],
  "metrics": {
    "duration_minutes": 0,
    "tool_calls": 0,
    "errors": 0,
    "recoveries": 0,
    "commits": 1,
    "files_changed": 12
  },
  "lessons": []
}
