{
  "id": "episode-2026-07-28-session-3562-safe-push-threads",
  "session": "2026-07-28-session-3562-safe-push-threads",
  "timestamp": "2026-07-28T00:00:00+00:00",
  "outcome": "success",
  "task": "Resolve the three Copilot review threads that reopened on PR #3568 after the object-id validator hardening: the multiplied pre-push timeout ceiling, the unwrapped FileNotFoundError from the validator import, and the verbatim argv comparison in the pre-push command test. Refs #3562.",
  "decisions": [],
  "events": [
    {
      "id": "e001",
      "timestamp": "2026-07-28T00:00:00+00:00",
      "type": "milestone",
      "content": "Diagnosed why PR #3568 reported BLOCKED while every required check was green. Branch protection here is a ruleset, so repos/OWNER/REPO/branches/main/protection returns 404; gh api repos/rjmurillo/ai-agents/rules/branches/main showed the code_quality rule, and the GraphQL reviewThreads query showed three unresolved Copilot threads.",
      "caused_by": [],
      "leads_to": [
        "e002"
      ]
    },
    {
      "id": "e002",
      "timestamp": "2026-07-28T00:00:00+00:00",
      "type": "milestone",
      "content": "Fixed the multiplied timeout. run_pytest now computes one deadline from TEST_SUITE_TIMEOUT_SECONDS and passes the remaining budget to each pytest command, refusing to start a command once the budget is spent. Before this change, splitting the suite into two processes gave each the full 1740s ceiling, so pre-push could block for twice the intended maximum and outlive lefthook's own deadline.",
      "caused_by": [
        "e001"
      ],
      "leads_to": [
        "e003"
      ]
    },
    {
      "id": "e003",
      "timestamp": "2026-07-28T00:00:00+00:00",
      "type": "milestone",
      "content": "Wrapped OSError and SyntaxError from the object id validator import so every load failure raises RuntimeError naming the module path, with the original exception preserved as __cause__. Previously a missing file produced a bare FileNotFoundError while a missing symbol produced a RuntimeError, so workflow logs told two different stories for the same class of failure.",
      "caused_by": [
        "e002"
      ],
      "leads_to": [
        "e004"
      ]
    },
    {
      "id": "e004",
      "timestamp": "2026-07-28T00:00:00+00:00",
      "type": "milestone",
      "content": "Replaced the verbatim argv comparison in test_pre_push_pytest_commands_include_safe_push_module with a parse of the marker expression, targets, and ignores, then asserted the two invariants that carry the safety: exactly one command ignores the safe-push module under 'not integration', exactly one targets it under 'not safe_push_transport', and no command reaches the module without deselecting the transport marker. Adding a benign flag no longer breaks the test.",
      "caused_by": [
        "e003"
      ],
      "leads_to": [
        "e005"
      ]
    },
    {
      "id": "e005",
      "timestamp": "2026-07-28T00:00:00+00:00",
      "type": "milestone",
      "content": "Ran the revert control. With both production changes stashed, four tests fail (absent-file path naming, unparsable-module path naming, shared timeout budget, refusal past budget) and 35 pass. test_run_pytest_stops_on_the_first_failing_command is a positive control and passes either way, which is correct because it guards pre-existing behavior.",
      "caused_by": [
        "e004"
      ],
      "leads_to": [
        "e006"
      ]
    },
    {
      "id": "e006",
      "timestamp": "2026-07-28T00:00:00+00:00",
      "type": "milestone",
      "content": "Verified the retrospective gate rather than bypassing it. _today_retrospective_exists accepts today or yesterday, and the most recent retrospective was 2026-07-26, so the date rollover past midnight is what blocked the push. Wrote a real retrospective instead of setting SKIP_RETROSPECTIVE_GATE.",
      "caused_by": [
        "e005"
      ],
      "leads_to": [
        "e009"
      ]
    },
    {
      "id": "e007",
      "timestamp": "2026-07-28T00:00:00+00:00",
      "type": "commit",
      "content": "Commit: 810bda7a",
      "caused_by": [],
      "leads_to": [
        "e008"
      ]
    },
    {
      "id": "e008",
      "timestamp": "2026-07-28T00:00:00+00:00",
      "type": "commit",
      "content": "Commit: a4487fcfd84d39ca098dcec84f36fdedd225e994",
      "caused_by": [
        "e007"
      ],
      "leads_to": []
    },
    {
      "id": "e009",
      "timestamp": "2026-07-28T00:00:00+00:00",
      "type": "milestone",
      "content": "Rebuilt .agents/memory/causality/causal-graph.json from committed episodes after repeated main and bot merges dropped the episode-2026-07-28-session-3562-safe-push-threads reference. The targeted causal graph coverage test passed before staging.",
      "caused_by": [
        "e006"
      ],
      "leads_to": []
    }
  ],
  "metrics": {
    "duration_minutes": 0,
    "tool_calls": 0,
    "errors": 0,
    "recoveries": 0,
    "commits": 2,
    "files_changed": 6
  },
  "lessons": []
}
