{
  "id": "episode-2026-07-03-session-2606-pr-2846-babysit",
  "session": "2026-07-03-session-2606-pr-2846-babysit",
  "timestamp": "2026-07-03T00:00:00+00:00",
  "outcome": "success",
  "task": "Drive PR #2846 fix/cluster-secgate to merged. Work only in dedicated worktree.",
  "decisions": [],
  "events": [
    {
      "id": "e001",
      "timestamp": "2026-07-03T00:00:00+00:00",
      "type": "milestone",
      "content": "Created dedicated PR worktree and assessed failing checks",
      "caused_by": [],
      "leads_to": []
    },
    {
      "id": "e002",
      "timestamp": "2026-07-03T00:00:00+00:00",
      "type": "milestone",
      "content": "Rebased fix/cluster-secgate onto origin/main and resolved conflicts",
      "caused_by": [],
      "leads_to": []
    },
    {
      "id": "e003",
      "timestamp": "2026-07-03T00:00:00+00:00",
      "type": "milestone",
      "content": "Fixed Python test and security-gate defects",
      "caused_by": [],
      "leads_to": []
    },
    {
      "id": "e004",
      "timestamp": "2026-07-03T00:00:00+00:00",
      "type": "test",
      "content": "Full suite passed: uv run pytest tests/ -x reported 13431 passed, 20 skipped, 45 xfailed before final session-log commit.",
      "caused_by": [],
      "leads_to": []
    },
    {
      "id": "e005",
      "timestamp": "2026-07-03T00:00:00+00:00",
      "type": "milestone",
      "content": "Regenerated generated artifacts and bumped plugin manifests",
      "caused_by": [],
      "leads_to": []
    },
    {
      "id": "e006",
      "timestamp": "2026-07-03T00:00:00+00:00",
      "type": "milestone",
      "content": "Updated PR body and resolved review feedback with fixes",
      "caused_by": [],
      "leads_to": []
    },
    {
      "id": "e007",
      "timestamp": "2026-07-03T00:00:00+00:00",
      "type": "milestone",
      "content": "Stabilized LSP read-guard tests under context-mode environment variables",
      "caused_by": [],
      "leads_to": []
    },
    {
      "id": "e008",
      "timestamp": "2026-07-03T00:00:00+00:00",
      "type": "test",
      "content": "tests/hooks/test_invoke_lsp_read_guard*.py now clear TMPDIR and pin CLAUDE_PROJECT_DIR in autouse fixtures. Targeted LSP guard tests passed: 67 passed.",
      "caused_by": [],
      "leads_to": []
    },
    {
      "id": "e009",
      "timestamp": "2026-07-03T00:00:00+00:00",
      "type": "milestone",
      "content": "Ran final validation before push",
      "caused_by": [],
      "leads_to": []
    },
    {
      "id": "e010",
      "timestamp": "2026-07-03T00:00:00+00:00",
      "type": "test",
      "content": "uv run pytest tests/ -x passed: 13299 passed, 20 deselected-by-marker, 45 expected failures, 3 warnings. Scoped uv run ruff check on 31 PR Python files passed. Full repo ruff still has unrelated baseline violations.",
      "caused_by": [],
      "leads_to": []
    },
    {
      "id": "e011",
      "timestamp": "2026-07-03T00:00:00+00:00",
      "type": "commit",
      "content": "Commit: f7c1b1f8ef2d",
      "caused_by": [],
      "leads_to": []
    },
    {
      "id": "e012",
      "timestamp": "2026-07-03T00:00:00+00:00",
      "type": "milestone",
      "content": "Rebased onto origin/main and rebumped plugin manifests after version race advanced",
      "caused_by": [],
      "leads_to": []
    }
  ],
  "metrics": {
    "duration_minutes": 0,
    "tool_calls": 0,
    "errors": 0,
    "recoveries": 0,
    "commits": 1,
    "files_changed": 4
  },
  "lessons": []
}
