{
  "id": "episode-2026-07-26-session-3401-knowledge-audit",
  "session": "2026-07-26-session-3401-knowledge-audit",
  "timestamp": "2026-07-26T00:00:00+00:00",
  "outcome": "success",
  "task": "Audit knowledge encoded in .claude/ and .serena/memories/ against the wiki concept notes, then ship atomic fixes for what the audit proves wrong",
  "decisions": [],
  "events": [
    {
      "id": "e001",
      "timestamp": "2026-07-26T00:00:00+00:00",
      "type": "milestone",
      "content": "One hypothesis falsified with evidence, one live defect located",
      "caused_by": [],
      "leads_to": [
        "e002"
      ]
    },
    {
      "id": "e002",
      "timestamp": "2026-07-26T00:00:00+00:00",
      "type": "milestone",
      "content": "49 findings to 28, 95 tests passing. The 26 remaining script_path findings are true orphans and are left for a separate change",
      "caused_by": [
        "e001"
      ],
      "leads_to": [
        "e003"
      ]
    },
    {
      "id": "e003",
      "timestamp": "2026-07-26T00:00:00+00:00",
      "type": "milestone",
      "content": "Silent routing failure removed from every copy of the orchestrator",
      "caused_by": [
        "e002"
      ],
      "leads_to": [
        "e004"
      ]
    },
    {
      "id": "e004",
      "timestamp": "2026-07-26T00:00:00+00:00",
      "type": "milestone",
      "content": "The boundary is now binding knowledge in the rule tree and the memory graph rather than tacit",
      "caused_by": [
        "e003"
      ],
      "leads_to": [
        "e005"
      ]
    },
    {
      "id": "e005",
      "timestamp": "2026-07-26T00:00:00+00:00",
      "type": "milestone",
      "content": "uv run resolves the pinned Python 3.14.6 again; tests run under uv rather than falling back to system python3",
      "caused_by": [
        "e004"
      ],
      "leads_to": []
    }
  ],
  "metrics": {
    "duration_minutes": 0,
    "tool_calls": 0,
    "errors": 0,
    "recoveries": 0,
    "commits": 0,
    "files_changed": 2
  },
  "lessons": []
}
