{
  "id": "episode-2026-07-15-session-3044-refresh-serena-project-schema-upstream",
  "session": "2026-07-15-session-3044-refresh-serena-project-schema-upstream",
  "timestamp": "2026-07-15T00:00:00+00:00",
  "outcome": "success",
  "task": "Refresh Serena project schema from upstream cb38f6f",
  "decisions": [],
  "events": [
    {
      "id": "e001",
      "timestamp": "2026-07-15T00:00:00+00:00",
      "type": "milestone",
      "content": "PR 3077 merged before upstream commit cb38f6f82aac111971e0bc96c542dbcd30eef946 was captured. Created and claimed issue 3078, fetched origin/main, and created fresh branch chore/3078-serena-schema-cb38f6f from bd9355362.",
      "caused_by": [],
      "leads_to": []
    },
    {
      "id": "e002",
      "timestamp": "2026-07-15T00:00:00+00:00",
      "type": "milestone",
      "content": "Serena commit cb38f6f82aac111971e0bc96c542dbcd30eef946 reported version 1.5.4.dev0. Regenerated .serena/project.yml through its project create command with the existing eight languages specified explicitly.",
      "caused_by": [],
      "leads_to": []
    },
    {
      "id": "e003",
      "timestamp": "2026-07-15T00:00:00+00:00",
      "type": "milestone",
      "content": "A second pinned Serena invocation activated the generated config without changing SHA-256 e45c1cf5e216bb1ff23eb50afe0af7383971d3ec1e676514133f1ef0dfc71abf. Semantic checks passed for 22 keys, and security detection reported zero findings across the three-file scope.",
      "caused_by": [],
      "leads_to": []
    },
    {
      "id": "e004",
      "timestamp": "2026-07-15T00:00:00+00:00",
      "type": "milestone",
      "content": "Validated the session log and source-only episode. PYTHONPATH=. uv run --frozen python -m scripts.validation.pre_pr completed with 29 passed, 0 failed, and 4 expected skips; the pre-commit review-marker advisory remains expected until the content commit is reviewed.",
      "caused_by": [],
      "leads_to": []
    },
    {
      "id": "e005",
      "timestamp": "2026-07-15T00:00:00+00:00",
      "type": "test",
      "content": "Validated the session log and source-only episode. PYTHONPATH=. uv run --frozen python -m scripts.validation.pre_pr completed with 29 passed, 0 failed, and 4 expected skips; the pre-commit review-marker advisory remains expected until the content commit is reviewed.",
      "caused_by": [],
      "leads_to": []
    },
    {
      "id": "e006",
      "timestamp": "2026-07-15T00:00:00+00:00",
      "type": "commit",
      "content": "Commit: bd9355362",
      "caused_by": [],
      "leads_to": []
    }
  ],
  "metrics": {
    "duration_minutes": 0,
    "tool_calls": 0,
    "errors": 0,
    "recoveries": 0,
    "commits": 3,
    "files_changed": 3
  },
  "lessons": []
}
